headline,real_or_fake
"India Is In The Middle Of A Coronavirus YouTube Frenzy, And It’s Going To Get People Killed",1
"Tweet: False reporting on ""shooting down"" people with the virus in China",1
"Tweet: A woman eating a delicacy, attributing the virus to eating ""bat soup""",1
Tweet: False chain message about NYPD containment actions,1
Hoax Alert: Viral 'Emergency Notification' On Coronavirus Is Fake,1
Coronavirus email scams are trying to cash in on your fear,1
UN health agency warns against coronavirus COVID-19 criminal scams,1
"Hackers made their own coronavirus map to spread malware, feds warn",1
Overhyped Coronavirus Weaponized Against Trump,1
"Says China ""stole Coronavirus from Canada and weaponized it into a Bioweapon.""",1
Alex Jones peddled a fake coronavirus cure that can turn people’s skin permanently blue,1
Amazon is selling coronavirus misinformation,1
Ability to hold your breath 10 seconds is not a test for coronavirus,1
CONSERVATIVE PASTOR CLAIMS HE 'HEALED' VIEWERS OF CORONAVIRUS THROUGH THEIR TV SCREENS,1
Will Sipping Water Every 15 Minutes Prevent a Coronavirus Infection?,1
Missouri Sues Televangelist Jim Bakker For Selling Fake Coronavirus Cure,1
"Can garlic, hot water, or masks prevent the spread of Covid-19? Here’s what doctors say",1
Fact Check: Weed kills coronavirus? Vivek Agnihotri shares scientific misinformation via meme,1
HOMEOPATHIC TREATMENT OF CORONAVIRUS,1
Leaked Emails: Norwegian Pressures Sales Team to Mislead Potential Customers About Coronavirus,1
Fact Check: Supermarkets Are NOT Recalling Coronavirus-Infected Toilet Paper,1
Facebook doubles down on removing coronavirus conspiracy theories,1
A Disturbing Number of People Think Coronavirus Is Related to Corona Beer,1
"Says a coronavirus patent expired just as there is a ""sudden outbreak"" and, despite ""media fear-mongering,"" there is already a vaccine available.",1
"Bioweapons, secret labs, and the CIA: pro-Kremlin actors blame the U.S. for coronavirus outbreak",1
Coronavirus: Russia denies spreading US conspiracy on social media,1
"China, pushing conspiracy theory, accuses US Army of bringing coronavirus to Wuhan",1
Facebook post: Coronavirus and Impeachment,1
Fox Business Network: COVID-19 Is a ‘Coronavirus Impeachment Scam’,1
Trump backers see a coronavirus conspiracy,1
Tom Cotton is playing a dangerous game with his coronavirus speculation,1
QAnon Supporters And Anti-Vaxxers Are Spreading A Hoax That Bill Gates Created The Coronavirus,1
Fox guest Jerry Falwell Jr. speculates that North Korea “got together with China” to create coronavirus,1
Iran’s regime pushes antisemitic conspiracies about coronavirus,1
Be Wary of Those Texts From a Friend of a Friend’s Aunt,1
"Hoax audio claiming to be from someone with sources at the Pentagon has spread online and across group chats. It mirrors the hoax texts attributed to other authorities, which have since been disavowed.",1
"Misinformation, fake news spark India coronavirus fears",1
"No, a Hair Dryer Won’t Stop Coronavirus",1
"Businesses offering ‘coronavirus services’ popping up in Houston, but consumers need to be careful",1
Coronavirus Phishing Scams Exploit Misinformation,1
Coronavirus and ibuprofen: Separating fact from fiction,1
South Africa: Coronavirus Misinformation Floods Lenasia,1
Coronavirus Disinformation Campaign: Russian Agents Trying To Sow Confusion And Distrust In The West,1
In a Europe Closed Down by the Coronavirus the EU Opens its Doors to the US Army. Could the Defender become the Invader of Europe?,1
"No, Dean Koontz did not predict the coronavirus in a 1981 novel",1
"Coronavirus in UAE: No, pesticides will not be sprayed from the sky",1
"Audio clip: False reporting on shutdown measures in Australia, falsely attributed to Health Minister",1
"A hoax about a national coronavirus quarantine spread onto TikTok, despite the platform's anti-misinformation policy",1
EU warns of ‘pro-Kremlin’ disinfo on coronavirus pandemic,1
Coronavirus: The fake health advice you should ignore,1
A White Nationalist Has Rebranded Himself as Coronavirus Expert. And People Are Flocking to Him.,1
How QAnon Fueled a Hoax About Oprah Being Arrested,1
Nigeria’s biggest battle with coronavirus will be beating misinformation,1
Why Coronavirus Misinformation Is Out of Control,1
In the News: Coronavirus and “Alternative” Treatments,1
How to Identify Fake Coronavirus Messages On WhatsApp,1
China Spins Tale That the U.S. Army Started the Coronavirus Epidemic,1
Coronavirus used to stoke fear of NATO exercise in Europe,1
Facebook has a coronavirus problem; It’s WhatsApp,1
"Elon Musk tweeted a piece of misinformation about children being 'essentially immune' to the coronavirus, but Twitter isn't taking it down",1
Social media spreading fake reports of door-to-door scammers in Timmins,1
"Contrary to False Posts, Sanitizer Helpful Against Coronavirus",1
Huge text message campaigns spread coronavirus fake news,1
The other viral problem in the COVID-19 pandemic: online misinformation,1
"Fact Check: No, clapping together at 5 pm during Janta curfew will not kill coronavirus",1
Coronavirus: Beware of false Nostradamus prophecy - THIS quatrain did not predict COVID-19,1
Vegan Instagram accounts spread misinformation about COVID-19,1
"Bat soup, dodgy cures and 'diseasology': the spread of coronavirus misinformation",1
The Wuhan coronavirus has nothing to do with 5G,1
"Bat soup, dodgy cures and 'diseasology': the spread of coronavirus misinformation",1
QAnon-ers’ Magic Cure for Coronavirus: Just Drink Bleach!,1
"Bat soup, dodgy cures and 'diseasology': the spread of coronavirus misinformation",1
"Bat soup, dodgy cures and 'diseasology': the spread of coronavirus misinformation",1
Message Claiming Coronavirus Can Last Up To 8 Hours In Air Is Misleading,1
"Coronavirus. Il medico israeliano che lavora a Parma e lo stop di cura agli over 60, un caso di disinformazione",1
Coronavirus: Union County warns against scams,1
Fox's Dr. Marc Siegel says “worst case scenario” for coronavirus is “it could be the flu”,1
A Fox News coronavirus special featured a quack doctor who told viewers to “conduct your life normally”,1
Sputnik: Coronavirus could be designed to kill elderly Italians,1
The coronavirus plaguing China was not created by a US government agency,1
Facebook post: graphic claiming China tried to cover up the COVID-19 outbreak,1
"No, no hay pruebas de que Bill Gates haya escrito una carta en la que diga que el coronavirus es ""el gran corrector"" y que ""está aquí para enseñarnos unas lecciones que parece hemos olvidado""",1
This photo is a stock image of a building that has circulated online since at least January 2019,1
Novel coronavirus: Australian authorities refute hoax about 'contaminated' foods and locations,1
Novel coronavirus: Australia refutes claims that a travel warning was issued for Queensland suburbs,1
Singapore denies it closed a subway station after novel coronavirus discovery,1
Chinese ‘spies’ did not steal deadly coronavirus from Canada,1
Australian health officials dismiss hoax report about new novel coronavirus case outside Sydney,1
This video was made by a student for a college project -- it does not show a trained doctor,1
"Chinese authorities have not recorded 300,000 confirmed novel coronavirus cases; there is no precise figure available for overall infections (as of February 4, 2020)",1
This photo has circulated in reports about a Japanese medical team travelling to China in 2008,1
"Not only is the source of the virus unknown, but the dead cells inside rhino horn also are incapable of keeping it alive",1
Health authorities did not say drinking water will prevent coronavirus,1
Health experts refute false claims that drinking boiled garlic water cures novel coronavirus,1
Indian health experts say there is no evidence of link between novel coronavirus transmission and specific food items,1
This video shows a former Malaysian prime minister praying in a Beijing mosque in 2004,1
He is not a doctor: Beware of the video in which a man claims with no evidence that respirators are taken off elderly COVID-19 patients in Spain,1
False novel coronavirus warnings circulating in Alberta,1
The Indian Health Ministry said it did not issue this 'emergency warning' via text message,1
Dettol’s manufacturer denied it tested its products on the novel strain of coronavirus,1
This video shows Chinese President Xi Jinping visiting a mosque in China in 2016,1
This video shows workmen uncovering a bat-infested roof in the US state of Florida in 2011,1
Fact Check: Are People Really Stuck In The Pilgrimage Centre Of Vaishno Devi?,1
"COVID-19 scam offering grocery vouchers with Coles, Woolworths",1
"FALSE: Coronavirus vaccine ready, can cure within 3 hours",1
This viral video shows a high-school initiation in South Africa,1
Lysol product labels are not evidence of a novel coronavirus conspiracy,1
This photo was circulated as a hoax -- the New South Wales health authority said it is unrelated to the novel coronavirus in Australia,1
Coronavirus. La bufala del dottore italiano arrestato per aver ucciso 3000 pazienti Covid-19,1
Scoop: Netanyahu shared fake video as proof of Iranian virus cover-up,1
This chart is old -- it has since been updated to accurately show a much lower H1N1 fatality rate,1
FALSE: Sara Duterte says 'blame LGUs' for slow disbursement of P200B,1
Philippine authorities did not issue this warning after the novel coronavirus outbreak,1
Black people aren’t more resistant to novel coronavirus,1
"This video shows a blast in Tianjin, China, in 2015 -- before the coronavirus outbreak in Wuhan",1
World Health Organization says COVID-19 means ‘coronavirus disease 2019’ – not 'China outbreak virus',1
"This video shows tower blocks in Shanghai, not Wuhan – and the clip has been edited to include the audio",1
"There are no known deaths or confirmed cases of the novel coronavirus in Nigeria as of February 18, 2020",1
Australian couple quarantined onboard Diamond Princess cruise reveal wine drone delivery story was 'just a prank',1
This map shows flight paths worldwide -- it does not show the movement of Wuhan residents,1
This video shows people sleeping rough in the Chinese city of Shenzhen,1
#CoronavirusOutbreak #Deankoontz this is odd,1
Don’t panic. This will suddenly vanish. A little more patience needed. ,1
The Simpsons Predicted Coronavirus!,1
So pastor Chris did slides and spent minutes to reinforce the conspiracy theory about 5G and CoronaVirus. ,1
I regret to inform you Woody Harrelson is posting 5G coronavirus conspiracy theories on Instagram.,1
Laal Topi is saying Coronavirus is a 5G conspiracy and your smart TVs are spying on you in your bedrooms.,1
"According to Prof. Robert Garry from Tulane University, “Wuhan wasn’t the origin of the virus”.",1
"Book predicted outbreak of coronavirus, says Kim Kardashian",1
Australian officials dismiss hoax report of coronavirus exposure at doctor's surgery in New South Wales town,1
This video was filmed before the novel coronavirus outbreak,1
This video has circulated online since at least March 2019 – months before the novel coronavirus outbreak,1
"No cases of the novel coronavirus have been confirmed in Zimbabwe as of February 20, 2020",1
"This map is a forecast based on past data, not real-time satellite readings",1
Bill Gates trends in South Africa after coronavirus anti-vaxxer conspiracy theory goes viral,1
Helicopters not spraying disinfectant over neighborhoods to stop virus,1
"Anti-malaria drug has proven effective in treating coronavirus but has not cured 12,552 patients",1
This video circulated online weeks before the novel coronavirus was first reported,1
This video has circulated in media reports since at least October 2019 -- months before the novel coronavirus outbreak,1
FALSE: Queen Elizabeth II’s quote praising Duterte,1
The Misinformation Pandemic Is Scarier Than the COVID-19 Pandemic,1
Fake message claims Dadar police register case against 52 people for misinformation on coronavirus,1
Old video falsely viral as Rahul and Priyanka Gandhi flouting coronavirus lockdown,1
These images have previously circulated in reports about an elderly Chinese couple who had unrelated health problems,1
International health advisories contradict false claim that a runny nose is not a coronavirus symptom,1
This photo has circulated in an online fundraising page for a man with a lung condition unrelated to the novel coronavirus,1
‘Coronavirus protection’ masks hawked in misleading video ad on Facebook,1
The video shows a police drill in China during the novel coronavirus epidemic,1
VERA FILES FACT CHECK: Viral FB post claiming Canada is now “COVID-19 free” FALSE,1
The story originated from a parody account; no driver is threatening to spread COVID-19 across Nigeria,1
US disease experts did not issue novel coronavirus-related facial hair guide,1
Hoax circulates that UK hospital has issued special advice to staff to prevent COVID-19 infection,1
FALSE: Quotes by personalities praising Duterte for coronavirus response,1
FALSE: FBI arrest of China-backed professor was linked to coronavirus,1
Coronavirus hoax spreads online after Rush Limbaugh broadcast,1
An image from The Simpsons was digitally altered to make it look like it predicted the novel coronavirus,1
"No, all international arrivals were not cancelled at an airport in Karachi in February 2020",1
An old photo of Buhari from before the pandemic was doctored to add face masks,1
Photo of ‘COVID-19’ rail tanker is not genuine,1
This photo was taken in South Africa in 2016 -- it is unrelated to the coronavirus pandemic,1
Cette vidéo de porcs enterrés vivants est-elle liée au coronavirus ?,1
This report is not from a genuine news site -- the Vatican said the pope was suffering from a cold,1
Health experts say drinking water every 15 minutes does not prevent coronavirus infection,1
Chloroquine has not been approved as a treatment for COVID-19,1
"These 14 claims on COVID-19 are viral, but misleading",1
The Philippine health department said it did not issue this 'checklist' for COVID-19 symptoms,1
This video shows two separate incidents involving different women in supermarkets,1
US President Donald Trump did not announce a coronavirus vaccine was 'ready',1
This meme does not show fully-stocked shelves during swine flu pandemic,1
US social media users mischaracterize Canada’s COVID-19 aid package,1
This video has circulated online since at least 2013 and shows people receiving Bibles,1
Inhaling steam will not treat or cure novel coronavirus infection,1
President: Iran Addressing COVID-19 Better Than Europe,1
Viral WhatsApp forward of ‘WHO lockdown protocol’ is fake,1
There is no known cure for the novel coronavirus and the patient has not yet been officially cleared,1
This report is a hoax -- the video was filmed one year before the novel coronavirus outbreak,1
Donating blood in US does not get you a novel coronavirus test,1
World Health Organization refutes viral claims that holding your breath can test for COVID-19,1
False claim circulates online that certain countries in Asia are using helicopters to spray 'COVID-19 disinfectant',1
This footage of looting was filmed years before the pandemic,1
Experts say eating garlic does not prevent COVID-19 -- and onions are no cure either,1
These photos show the coffins of victims of a boat disaster in 2013,1
"No, US and UK have not selected PM Modi to lead a coronavirus task force",1
False: Rahul Kanwal’s claim about Trump suggesting early access of COVID-19 vaccine to India,1
Disaster Management Act does not prohibit coronavirus posts on social media,1
"Indians do not have genetic protection against coronavirus, published research incorrectly interpreted",1
"No, Indian army has not built 1000-bed quarantine facility for coronavirus patients",1
"No, Dr Ramesh Gupta’s zoology book DOES NOT mention a cure for novel coronavirus",1
Did a man in Goa come up with an innovative way to make people stay indoors ?,1
There won’t be any medicine sprayed by Helicopters to kill COVID-19,1
The viral circular regarding the closing down of hotels and restaurants is Fake,1
[新型コロナFactCheck] 緊急事態宣言で｢知事に強制的ロックダウンの権限付与｣との米報道は誤り,1
"Chine : un médecin atteint du coronavirus s’évanouit dans un hôpital de Wuhan ? Attention, intox !",1
Fake US hospital letter says alcohol reduces COVID-19 risks,1
"There have been no deaths from the novel coronavirus in South Africa (as of March 12, 2020)",1
False claims that drinking water with lemon can prevent COVID-19 circulate online,1
Did An American CEO Draw This Map To Praise Indian Govt.'s COVID-19 Response?,1
War Veteran's Image Shared As Recovery Of Old Man From COVID-19 In Italy,1
Iran parl. body rejects fake coronavirus tolls reported by foreign media,1
This doctored image contains a 2015 photo of Tom Hanks and the ball in the movie 'Cast Away',1
Employer did not hide advice to skip work on COVID-19 poster,1
Costco is not recalling bath tissue due to novel coronavirus contamination,1
The incident happened in another part of South Africa long before the novel coronavirus outbreak,1
Consuming silver particles will not prevent or treat novel coronavirus,1
False COVID-19 hotline number shared on Facebook in Ontario,1
"The last day South African schools will be open is Wednesday, March 18; they will be closed thereafter",1
This photo has circulated online since 2017 -- over two years before the novel coronavirus outbreak,1
Health experts say comparing death tolls of an emerging epidemic with longstanding diseases risks underplaying COVID-19,1
Articles spread Tim Hortons closure hoax in Canada,1
Australia's Department of Health did not issue a warning that 'using petrol pumps can spread COVID-19',1
Hoax claim circulates online that Israel has no COVID-19 cases after it developed a 'cure',1
Nigeria is not paying citizens for staying at home amidst coronavirus pandemic,1
Reopening date for South Africa’s schools has not been announced,1
"No evidence drinking tea can cure or relieve symptoms of COVID-19, doctors say",1
"This video was filmed in 2011, nearly a decade before the novel coronavirus outbreak",1
"Manufacturers say 'free baby formula' offer is a hoax, after coronavirus sparks panic buying",1
Buckingham Palace did not say the Queen tested positive for coronavirus,1
Spanish politician misidentified in posts saying soccer players should find novel coronavirus cure,1
Hoax circulates on social media that Australian supermarket worker has tested positive for COVID-19 in New South Wales suburb,1
"Police dismissed the claims as a hoax, which were based on an old story",1
"Non, le Covid-19 n’est pas une « combinaison du SRAS et du sida »",1
South African health authorities urge public not to share hotline graphics with false information,1
"False posts claim COVID-19 existed before 2019, use animal vaccines as proof",1
"Hot air from saunas, hair dryers won’t prevent or treat COVID-19",1
Coronavirus is a man made American virus with the ultimate goal tracking all the people through the vaccine,1
"South Africa’s first coronavirus patient now has no symptoms, but not ‘cured’",1
Sharing info about Covid-19 not a crime in South Africa – but sharing false info is,1
Not all these South African coronavirus ‘lockdown procedures’ correct – use official regulations instead,1
WhatsApp message falsely links BC mall to COVID-19 outbreak,1
UNHCR condemns fake notice which claimed refugees in Malaysia are resisting COVID-19 tests,1
Scientists in Israel are still working on developing a vaccine for COVID-19,1
There is no evidence to support the claim that Ghana’s President Akufo-Addo tested positive for the novel coronavirus,1
This image has circulated in reports about China testing a potential COVID-19 vaccine that has not been approved by health authorities,1
Times of India Misreports Agra Woman Fleeing After Coronavirus Tests,1
False: Chicken Infected With Coronavirus In Bangalore,1
Does Drinking Alcohol Prevent Coronavirus?,1
Fake Messages Claim Shaheen Bagh Protester Tested Positive For Coronavirus,1
Cropped Aaj Tak Video Used To Spread Misinformation On Coronavirus,1
"No, Cristiano Ronaldo's Hotels Will Not Be Turned Into Hospitals For Coronavirus Patients",1
Coronavirus Rumours Hit Mumbai Hotels Westin And Fatty Bao,1
Scene From Mini-Series Pandemic Peddled As Coronavirus Mass Grave,1
Coronavirus: Dated Photos Of Kanika Kapoor Meeting Prince Charles Surface With False Claim,1
Mumbai Police Rubbishes Viral Message On Timings Of Essential Items Sold,1
TikTok Video On Coronavirus Goes Viral As Doctor's Advice,1
This video shows a security exercise simulating a hostage-taking at Dakar airport,1
"Gargling warm salt water or vinegar does not prevent coronavirus infection, health experts say",1
Misleading COVID-19 flyer falsely linked to US Veterans Affairs hospital,1
Health experts refute misleading 'timeline' of COVID-19 symptoms,1
Police dismiss false claim that Australian factory hoarded COVID-19 supplies to export to China,1
Australian health authorities refute hoax about 'free home checks' for suspected COVID-19 cases,1
Singapore General Hospital said its car park would be temporarily used to test suspected COVID-19 patients,1
Myth circulates online that 'new' hantavirus disease has emerged in China,1
False claims on patents fuel novel coronavirus conspiracy theories online,1
Viral video misidentifies COVID-19 patient as Canadian PM’s wife,1
Viral WhatsApp voice note in Nigeria makes misleading claims about COVID-19 fatalities projections,1
Ugandan and Kenyan authorities reject claims that they told landlords to stop rent collection,1
"Video shows Zimbabwe police beating opposition members, not churchgoers defying virus rules",1
Nigerian TV screenshot of '472 confirmed cases' refers to Lassa fever ⁠— not COVID-19,1
Message Claiming Coronavirus Can Last Upto 8 Hours in Air is Misleading,1
McDonald's of Guam says rumors of COVID-19 case are false,1
Coronavirus rumor mongers are enemies of the state says Minister,1
UN warns of deadly effect of Covid-19 misinformation in Pacific,1
Fear and misinformation go viral in Fiji,1
"Dr Waqainabete To Lynda: Think About The Lives, Not The Likes On Facebook",1
"As coronavirus misinformation spreads on social media, Facebook removes posts",1
No coronavirus cases on Saipan,1
Indian authorities refute 'fake' claim about food markets closing in Chennai during COVID-19 lockdown,1
This Pakistani bank said no employees had tested positive for COVID-19 and its branches remained open,1
Health authorities warn of false COVID-19 prevention tips online,1
Hemingway phrase misrepresented as Trump and Biden statement on COVID-19 death toll,1
Photos of vaping illness patients used to make false COVID-19 claim,1
"Non, un Prix Nobel japonais n’a jamais défendu la thèse du SARS-CoV-2 inventé en laboratoire",1
"Non, cette vidéo ne montre pas deux journalistes américains sous-entendre que le Covid-19 est un canular",1
Let's not allow bat and his kin to rule the globe,1
These photos show the aftermath of a powerful earthquake in Croatia,1
Calling this number will not get you food aid in the US,1
Australian health authorities dismiss hoax claim about 'rescue packs' for vulnerable patients,1
‘It’s a myth’: South Australian health authorities dismiss rumour about an ice rink-turned-morgue for COVID-19 victims,1
This video shows donations for victims of a deadly earthquake that hit eastern Turkey in January 2020,1
19-year-old France returnee female student tested positive: Could she be the super-spreader? ,1
FALSE: Nobel Prize winner Dr Tasuku Honjo says coronavirus is 'manufactured',1
Facebook posts falsely claim the US arrested a Chinese scientist who “created” coronavirus,1
Ethiopia has not approved traditional medicine to treat COVID-19,1
Misleading posts claim ventilators are ‘stuck’ in New York warehouse,1
New misinformation circulates online in Asia about creation of vaccine and drug for COVID-19,1
Extinction Rebellion said it did not issue this poster about the coronavirus,1
Experts dismiss claims that 5G wireless technology created the novel coronavirus,1
South African hospital group rejects claim that lab found COVID-19 on fresh produce,1
"No, these videos do not show recent looting in South Africa",1
This video shows pro-democracy protesters in Hong Kong in August 2019,1
"This video of an orangutan has circulated in reports since November 2019, months before the novel coronavirus pandemic",1
"This CNN broadcast has been doctored, Nigerian leader did not test positive for coronavirus",1
CEOs of these companies did not all step down during novel coronavirus crisis,1
Misinformation circulates online about COVID-19 cases and lockdown measures in Asia,1
"Non, personne ne fait du porte-à-porte pour vous proposer des masques imbibés de produit anesthésiant (lien signalé sur Facebook)",1
[新型コロナFactCheck] ｢都市封鎖の東京に鹿｣ アルジャジーラが誤報,1
Hoax circulates in India that government has banned coronavirus-related posts on social media,1
"These photos have circulated online since at least March 2019, before the COVID-19 pandemic",1
This is an AFP photo shot in 2006 during an unrelated incident,1
This poem was written in 2020 specifically about the COVID-19 pandemic,1
"COVID-19 corpses video was shot in Ecuador, not New York",1
Hoax circulates online in Hong Kong that COVID-19 was transmitted through fruits and vegetables,1
This photo has circulated in reports about an Irish teenager who died in 2017,1
Nigerian health authority denounces fake social media accounts,1
This video was edited to make it look like South Africa’s leader announced an 81-day lockdown,1
This video was shot in Azerbaijan in October 2019 during an anti-government protest,1
