headline,real_or_fake
"FALSE: Post claims food products such as rice, fortune cookies, mi goreng noodles, ice tea and “Chinese red bull” are contaminated with coronavirus in Australia. Also some areas of Sydney are supposedly identified as contaminated",1
False: A Saudi Arabian study for a MERS vaccine is linked to the outbreak of coronavirus.,1
"False: A “Wuhan super virus” was created in a Chinese biosecurity lab and has infected more than 100,000 people in Wuhan.",1
False: The Dettol disinfectant label says COVID-19 was tested.,1
Wabak COVID-19 Di Daerah Ranau Bukan Berpunca Daripada 14 Individu Kluster Tabligh,1
No Nigerian minister said Igbos would be denied funds because of Biafra,1
Chuck Norris felled by a tiny virus? Don’t believe it,1
Conspiracy claim linking COVID-19 reports with the number 322 is nonsense,1
Claim that N95 masks can’t stop COVID-19 particles due to size is nonsense,1
"No, Gretchen Whitmer isn’t George Soros’s niece",1
"Masks for COVID-19 are effective, as a six-part Facebook takedown fails",1
Facebook Post Repeats Flawed Claim on Wuhan Lab Funding,1
Meme Misrepresents Fauci’s Position on Vaccine Trials,1
"Nuremberg Code Addresses Experimentation, Not Vaccines",1
Outdated Fauci Video on Face Masks Shared Out of Context,1
Viral Posts Mislead on COVID-19’s Toll on Health Care Workers,1
Legislative History of CARES Act Doesn’t Prove COVID-19 Conspiracy,1
FACT CHECK: VIRAL IMAGE CLAIMS VENTURA COUNTY WILL FORCIBLY REMOVE PEOPLE WHO TEST POSITIVE FOR COVID-19 FROM THEIR HOMES TO QUARANTINE,1
Fact Check: COVID-19 Trackers NOT Installed On Phones Without Public's Knowledge During Phone Disruptions,1
Fact Check: OSHA Did NOT Say Cloth Masks Don't Work And Will Reduce Oxygen To Danger Levels,1
Fake prescription viral in the name of Sir Ganga Ram Hospital debunked by the hospital,1
Video from West Bengal shared as people disregarding social distancing in Mumbai bus,1
Old video from China shared as Zee News employee assaulting doctor in hospital,1
Fact Check: Henry Kissinger Did NOT Say The Solution To Coronavirus Is The 'New World Order',1
"Fact Check: Bill Gates, The CDC, Drs. Fauci And Birx NOT 'Silent' On Protests; COVID-19 Lockdowns NOT A 'Scam'",1
Fact Check: NO Supporting Evidence That Heroin Killed More People 'Yesterday' Than The Coronavirus,1
Fact Check: Media Outlets DID Suggest George Floyd Protests Could Cause A COVID-19 Spike,1
"No, AOC didn’t tweet this about closing businesses until after the election",1
Fact Check: The Little Girl In The Viral Photo Asking For Prayers Does NOT Have Coronavirus - The Sign In The Picture Is Photoshopped,1
Cancellation of sports club memberships during quarantine: incorrect information,1
Ghana leader falsely claims his country fronts Africa's COVID-19 testing,1
"Fake Claims Promising Free ₹5,000 Lockdown Funds Viral On WhatsApp",1
"No, Mumbai's KEM Hospital Did Not Prescribe This List Of COVID-19 Drugs",1
Old News Clip Fuels False Claim Of Lockdown In Maharashtra From June 15,1
FACT CHECK: IMAGE CLAIMS GEORGE FLOYD’S DEATH WAS FILMED BEFORE THE CORONAVIRUS PANDEMIC,1
"Yes, Gov. Newsom has the authority to make masks mandatory In California, legal experts say",1
"With Holocaust comparison, misleading Facebook post claims Bill Gates seeks 'digital tattoos'",1
"No, Thane Thyrocare Lab Is Not Sealed Over False Positive COVID-19 Tests",1
Viral Message Recommending COVID-19 Home Kits Is Not From Tata Health,1
Viral Message Falsely Claims Coffee Can Cure COVID-19,1
"No, Video Of Patients Dancing At COVID-19 Centre Is Not From Mumbai",1
Journalists targetted in Papua New Guinea amid the COVID-19 Pandemic while nurses strike over lack of protection,1
Fiji's residents spread rumors that vodka is a herbal tea cure for the Coronavirus,1
Three appear in court for posting false information on social media ,1
"Alcohol-based hand sanitiser cannot catch fire, without a spark, just because it's in a hot car",1
Police have not warned the public about face masks doused in chemicals,1
The Covid-19 track and trace app has not been automatically downloaded onto people’s phones,1
Chris Whitty did not personally receive millions of pounds from the Bill & Melinda Gates foundation,1
"No, the Mail didn’t use an old photo of Jeremy Corbyn to claim he wasn’t social distancing on his birthday",1
This viral UK Facebook post claiming 31 million job losses probably refers to the USA,1
We don’t know the true Covid-19 survival rate yet,1
"The 1918 pandemic did have a deadly second wave, but not due to quarantine being lifted",1
Police officers around the world have died from Covid-19,1
Clarification regarding falsehood published by Singapore States Times on quarantine of foreign workers,1
CEK FAKTA: Hoaks Kondisi Tenggorokan Pasien Terinfeksi Covid-19,1
Photo shown overgrown shrubs at Malaysian theme park's escalator,1
 Malaysian nationals storming a customs office in the Malaysian state of Johor after Singapore closed its borders in an effort to curb the growing COVID-19 pandemic,1
"Cette vidéo d’un ""hôpital vide en plein Covid-19 au Brésil"" est détournée de son contexte",1
Leicester going back into lockdown has nothing to do with 5G,1
This photo of Brighton was taken during the coronavirus lockdown,1
Two police forces did not use the same photo to illustrate two different lockdown crimes,1
The Control of Diseases Act was not changed in April to say you can be forcibly vaccinated,1
There’s no evidence immigrants caused a PPE shipment to be destroyed at Dover,1
UK branches of McDonald’s did not reopen on 27 April,1
It is not true that worldwide terrorism has stopped while western countries fight Covid-19,1
"No, Fauci isn’t married to Ghislaine Maxwell’s sister",1
"No, New York state hospitals didn’t report thousands of lung infections caused by face masks",1
COVID-19 tests are not ‘scientifically meaningless’,1
"No, 169 Residents Of A Mumbai Apartment Have Not Tested COVID-19 Positive",1
"No,This Letter Is Not AYUSH Ministry's Nod To Patanjali's Coronil",1
Does Drinking 'Kashayam' Cure COVID-19? A Factcheck,1
2013 Video Of Unclaimed Bodies At Osmania Hospital Given COVID-19 Spin,1
Video Shows Hospital Overwhelmed By COVID-19 Cases In Pakistan? Not Quite,1
FactCheck: Audio Message Claims Steam Inhalation Kills COVID-19,1
Fact Check: CDC Testing Kits For COVID-19 NEVER Risked Lives,1
Fact Check: There Is NOT A Spike In Coronavirus Cases Just Because There's An Increase In Testing,1
Fact Check: CDC Did NOT Say The Common Cold Is Counted As A Positive COVID-19 Result,1
Fact Check: NO Evidence San Francisco Hospital Faked Positive COVID-19 Tests,1
Misinformation circulates about Japan’s plan to subsidise tourism after coronavirus lockdown is lifted,1
"No, wearing a mask doesn’t void concealed-carry permit",1
Claim that Democratic leaders aren’t using masks based on old picture,1
"No, the CDC is not on the verge of lifting 'epidemic' label for COVID-19",1
"No, the US is not alone in facing a possible second wave of COVID-19 infections",1
Painting of Children in Masks Isn’t a 1994 Airport Mural,1
"Is This Obama, Fauci, and Gates at a Wuhan Lab in 2015?",1
Did Betsy DeVos Say COVID-19 Will ‘Only’ Kill .02% of US Students?,1
Don’t trust this comparison of daily coronavirus deaths with other diseases,1
Fact check: Trump did not tweet about South Dakota closing its border with California,1
Viral video misidentifies COVID-19 patient as Canadian PM’s wife,1
Coronavirus. Il premio Nobel Mukwege ammette di aver mentito sul Covid19? Fake complottista,1
"Beredar Foto Obama, Fauci dan Melinda Gates di Laboratorium Wuhan pada 2015? Ini Faktanya",1
Police do have legal powers to enforce face covering laws,1
Claims that Muslims caused Leicester’s Covid-19 outbreak are baseless,1
There is no evidence supporting claims about a government-run network of fake NHS Twitter accounts,1
"Not all New Zealand MPs have been ordered to take a pay cut, and UK MPs have not awarded themselves a £10,000 bonus",1
JustGiving are not keeping £2 million commission from donations to Captain Tom Moore,1
The nurses that treated Boris Johnson for coronavirus are real UK nurses,1
"No, the UK didn’t turn down 50,000 ventilators offered by the EU",1
False posts that suggest Boris Johnson didn’t have Covid-19 are based on a blog post now labelled as satire,1
£20 notes don’t have a secret message about 5G and coronavirus,1
"This video of body bags in a hospital was not filmed in St Mary’s, London",1
Ignore these pranks on Facebook saying lockdown will be lifted in the next few days,1
Photo circulating of busy mosque was taken before lockdown,1
This text message is not an official government communication,1
Xbox and PlayStation servers are not being shut down during school hours,1
That picture people are saying shows the army in Clapham Junction is actually of students,1
[新型コロナFactCheck] ｢WHOが方向転換『感染者の隔離は不要』｣は誤り,1
FALSE: There is currently no vaccine against COVID-19,1
Misreported test data in Orlando does not explain Florida’s COVID-19 outbreak,1
"Books removed from school because they were outdated, not contaminated by the coronavirus",1
Don’t fall for this hoax about monthly stimulus checks,1
Donald Trump wrong to say U.S. has “one of the lowest mortality rates in the world” from COVID-19,1
"Black seed oil medicinal, but not proven cure for Covid-19",1
"Pax herbal remedy not approved as Covid-19 treatment, says Nigeria’s drug control agency",1
"No, dexamethasone not a Covid-19 vaccine, no evidence it causes infertility",1
No evidence drinking ‘asthma plant’ tea helps Covid-19 breathing complications,1
"South African government digging graves for million Covid-19 dead? No, clarifies that number for burial capacity in Gauteng",1
"No, Uganda police not investigating guests at People Power spokesperson’s wedding",1
"Jobs at World Health Organization? No, message and website a scam",1
"No, Nigerian politician Ajimobi didn’t recover from Covid-19 ",1
Another scam Facebook post using South Africa’s Covid-19 social relief grant,1
Government official monetized racial tensions on South African social media,1
Quickmart supermarket is not hiring ‘urgently’ due to Covid-19,1
"No, Nigerian govt not giving N30,000 Covid-19 relief to each citizen ",1
"No, governor of Nigeria’s Kano state didn’t say Covid-19 patients released from isolation centres to ‘celebrate sallah’",1
"Hungry Lion ‘back from lockdown’ and hiring? No, Facebook ad fake",1
"Scramble for upcountry travel after Kenyan travel ban lifted? No, photo from 2017 ",1
"Discrimination in China? No, video shot in New York, USA",1
"Tanzanian president drumming to celebrate ‘defeat’ of coronavirus? No, video from 2016",1
Health authorities did not say drinking water will prevent coronavirus,1
Singapore denies it closed a subway station after novel coronavirus discovery,1
Singaporean authorities refute hoax about 'spot fines' for people violating social distancing orders,1
This image has circulated in reports about China testing a potential COVID-19 vaccine that has not been approved by health authorities,1
Misinformation about fines in Singapore circulated online before face masks made mandatory in public,1
This video actually shows a 2012 election victory parade in Singapore,1
Corrections and clarifications regarding falsehoods posted on HardwareZone Forum Post,1
Corrections and clarifications regarding falsehoods published by AB-TC City News' website,1
"[SALAH] Daftar Perlengkapan Medis di Rumah Untuk Hadapi Covid-19
",1
Benarkah Ahli Virus Cina Klaim Covid-19 Hasil Persekongkolan Jahat?,1
"Cek Fakta: Salah, Quotes Pidato Muammar Gaddafi Soal Virus di Kantor PBB",1
Corrections and clarifications regarding falsehoods published by States Times Review on availability of face masks,1
Corrections and clarifications regarding falsehoods published by States Times Review on COVID-19 situation,1
Corrections and clarifications regarding falsehoods that dinner event at SAFRA Jurong was organised by People’s Association,1
Corrections and clarifications regarding falsehoods about the Resilience Budget,1
Clarification on falsehood posted by TTR on food delivery rider,1
Corrections and Clarifications Regarding Falsehoods Published by Singapore States Times on the Reporting of COVID-19 Cases in Singapore,1
Corrections and clarifications regarding falsehood on cross-border travel arrangements between Singapore and Malaysia,1
"Clarification regarding falsehood published by the National University of Singapore Society (NUSS), The Online Citizen Asia (TOC), CNA and New Naratif on MOM’s advisory on testing of migrant workers",1
[COVIDWatch]: Has a ‘COVID-19 tracker’ been secretly installed in your smartphone?,1
[COVIDWatch]: Is ‘Phase 2A’ tentatively happening on 22 June?,1
[COVIDWatch]: Is Singapore going into lockdown after the elections?,1
[COVIDWatch]: Is wearing PPE the ‘new normal’ for air travel?,1
No announcement on when Uganda’s schools will reopen,1
"UN ‘not sure’ there’s Covid-19 in Africa, thinks leaders using crisis to make money? No, claim ‘fake indeed’",1
"Janet Museveni, wife of Ugandan president, has Covid-19? No, tweet is fake",1
2005 chloroquine study had nothing to do with COVID-19 and the drug wasn’t given to humans,1
"No, CDC did not admit a mistake, did not reduce its COVID-19 Florida case count",1
"No, the Trump administration hasn’t fulfilled every state request for coronavirus supplies",1
Anthony Fauci didn’t write this Facebook post about viruses,1
Video Misrepresents the Science Behind Face Masks,1
"COVID-19 Testing Truck Logo Depicts an Aardvark, Not Death Deity",1
Viral photo does not show Bharat Biotech’s VP taking first dose of COVID vaccine ‘Covaxin’,1
Video from Pakistan shared as patients lying in beds outside hospital in Hyderabad and Mumbai,1
Old message of blood donation drive revived as ‘plasma donation’ in the wake of COVID-19,1
Goat “arrested” for not wearing mask in Kanpur? Bizarre media misreports,1
"No, Nanavati Hospital does not recommend lemon, turmeric for COVID “treatment”",1
"WHO doesn’t claim asymptomatic patients cannot spread COVID, isolation is still advised",1
Russia’s Sechenov University has NOT ‘completed’ COVID vaccine clinical trials; media misreports,1
Old video of Amitabh Bachchan thanking Nanavati Hospital staff viral as recent,1
Age-Old Home Remedy Peddled As COVID-19 Cure Found By Indian Student,1
"Viral Kawat dalam Masker Medis Disebut Antena 5G Pembunuh, Ini Faktanya",1
Cek Fakta: Hoaks Nama Covid-19 Berasal dari Bahasa Latin,1
[COVIDWatch]: Is this the situation at the Changi Exhibition Centre isolation facility?,1
[COVIDWatch]: Is this message being sent to close contacts of COVID-19 cases?,1
[COVIDWatch]: Is Singapore Expo a new COVID-19 infection cluster?,1
"Faux, Emmanuel Macron n’a pas menacé de refuser le visa aux africains qui n’auraient pas reçu un vaccin européen",1
This footage was taken during an electoral campaign months before the pandemic,1
Kenya governor quotes non-existent WHO research to defend alcohol donations,1
TV report shows an unrelated Guinea incident predating COVID-19 outbreak,1
Nigeria imposed a curfew to slow the spread of COVID-19 and has not yet set up 5G networks,1
Experts say freediver’s video about masks contains misleading claims,1
Madagascan president has not called on African states to quit WHO,1
"The money was to help Madagascar fight the outbreak, not to produce a cure",1
No evidence robbers are using chemical-laced face masks on victims in South Africa,1
Experts reject conspiracy theories about ‘5G microchip implants’,1
Article shared thousands of times uses false clickbait headline,1
Health ministry rejects online rumours of a herbal cure,1
Business grant scam in Uganda resurfaces on Facebook,1
Woman in viral video makes misleading claims about face masks,1
List of unproven COVID-19 treatments debunked by health experts,1
Hoax claims about rival pair’s whereabouts end with broadcasts from their Juba homes,1
The photo shows a baby who had heart surgery in 2012,1
Brazilian MP was angry because new COVID-19 hospital was not operating yet,1
False claims circulate that global COVID-19 fatalities have surpassed 1.6 million,1
Experts say corpses infected with COVID-19 do not get more infectious over time,1
"[SALAH] Virus ini punya obat Hydroxychloroquine, Zinc dan Zithromax",1
[COVIDWatch]: Is the Singapore Government easing Circuit Breaker measures in 5 phases?,1
"[COVIDWatch]: Are “most foreigners” fined $10,000 for their first offence of Circuit Breaker measures?",1
[COVIDWatch]: Is this ‘Social Distancing Ambassador’ job opening legitimate?,1
[COVIDWatch]: Was this Grabfood rider fined for wearing the wrong mask?,1
[COVIDWatch]: Are you only allowed to exercise with a maximum of one family member?,1
The BBC did not say that the Bill & Melinda Gates Foundation is planning to put microchips in Covid-19 vaccines,1
Misleading claims on pre-existing conditions and Covid-19 deaths go viral,1
Surgical masks may offer some protection to the wearer from Covid-19 and may stop them from infecting others,1
You do not have to legally lower your mask for lip-readers,1
There is no indication that a Covid-19 vaccine will be mandatory or that those who don’t get it will have their movements restricted,1
It’s incorrect to say there was no resistance to safety measures around the Blitz,1
It’s not true that 58% of Covid-19 deaths in Scotland were in care homes,1
This letter claiming to be from a doctor in Surrey is full of errors,1
Mask graphic contains a number of inaccuracies,1
[COVIDWatch]: Are spot checks being done at homes to ensure no social gatherings are happening?,1
[COVIDWatch]: Are road blocks being set up to check on why people are on the road?,1
[COVIDWatch]: Is Singapore rejecting all international packages?,1
[COVIDWatch]: Are people in the US looting stores because of COVID-19?,1
[COVIDWatch]: Did Singapore follow President Donald Trump’s COVID-19 guidelines?,1
"[COVIDWatch]: Can Singaporeans withdraw $2,000 from their Ordinary Accounts from 1 April?",1
[COVIDWatch]: Are military helicopters spraying “pesticides against COVID-19” over countries?,1
[COVIDWatch]: Is Singapore ceasing imports of supplies and heading for a lockdown?,1
[COVIDWatch]: Was this a video taken during the SAFRA Jurong private event?,1
[COVIDWatch]: Are Tankers Not Allowed To Dock In Singapore Because Of The Virus?,1
"Saliva tests for Covid-19 exist, but less accurate than nasal tests",1
"Heineken South Africa not closing, but has scrapped plans for new brewery",1
"Uganda’s health ministry ‘discussing’ announcement of third Covid-19 death? No, Facebook post fake",1
Kenyan Covid-19 ‘relief funds’ website a scam,1
"No, Ugandan police announcement of arrest for people wearing masks wrong",1
"No, UN didn’t tweet list of ‘most corrupt’ African countries under Covid-19",1
"No, Uganda’s exams board hasn’t announced online exams ",1
"‘Huge’ IMF fund for Zimbabwe’s entrepreneurs? No, just another scam",1
No evidence ram tested positive for Covid-19 in northern Nigeria,1
Google and Apple’s Covid-19 notification technology no ‘secret’,1
"No, Ugandan health ministry did not raise alarm about quarantined Covid-19 patients having sex",1
Nigeria’s anti-corruption czar DID say coronavirus was caused by corruption,1
Cek Fakta: Tidak Benar Pandemi Flu Babi Tahun 2009 Lebih Bahaya daripada Covid-19,1
"Cek Fakta: Tidak Benar Klaim soal Tingkat Kesembuhan Covid-19 Capai 99,9 Persen",1
Cek Fakta: Hoaks Vaksin Flu Spanyol Membunuh 50 Juta Orang,1
"No, Ugandan parliament speaker’s coronavirus ‘cure’ just external disinfectant",1
"No, Uganda hasn’t ‘suspended’ sex during Covid-19 crisis",1
"No, Ghana university hasn’t developed coronavirus vaccine",1
"No, coronavirus patient in China not ‘cured’ with HIV drugs",1
"No, garlic doesn’t cure coronavirus. Get Covid-19 facts only from experts",1
"No, drinking alcohol won’t kill the coronavirus",1
Coronavirus is not pneumonia – and symptoms of Covid-19 can be like common cold,1
Photo not of Italian doctors dead from Covid-19 – it’s from TV drama Grey’s Anatomy,1
[COVIDWatch]: Was A Chinese Prostitute With COVID-19 Asked To Name Her Clients By MOH?,1
[COVIDWatch]: Did CNA Tweet That Schools Are Closing From 10 Feb?,1
[COVIDWatch]: The Cure For Coronavirus?,1
Covid-19 Sensor Has Not Been Inserted Into Your Mobile Phone… Here’s The Truth!,1
Wedding Pre-Shoot Images Of Couple Shared As COVID19 Patient Proposing To His Doctor,1
FAKE NEWS ALERT: Dr. Elena Granato Is Not Dead…,1
Is There A Pandemic Every Hundred Years As These Viral Posts Claim?,1
Are People In India Violating Lockdown By Gathering On Rooftops?,1
Does This Image Show Lock Down Protocol Violators Physically Punished By Nepal Police? Here’s The Truth…,1
Was This Child Abandoned Because Both His Parents Were Infected With Covid-19? Here’s The Truth,1
WHO Director General’s Old Statement On SL Health Services Shared Out Of Context; Read The Truth Here….,1
No. These Are Not Deceased COVID19 Victims Washed Ashore!,1
Investigation Into WhatsApp Messages Circulating In Sri Lanka Related To COVID19,1
Investigation Into WhatsApp Messages Circulating In Sri Lanka Related To COVID19,1
Investigation Into WhatsApp Messages Circulating In Sri Lanka Related To COVID19,1
No. President Has Not Issued 10 Point Bulletin For Citizen To Be Followed During COVID19,1
"No, These Images Are Not Of Currency Notes Thrown On Streets By Italians…",1
"No! These Aren’t Visuals Of Mass Graves In Italy But, A Scene From A Science Fiction Movie!",1
FACT CHECK: Clip Of A 2013 Korean Movie “Flu” Gets Viral As Visuals From Italy.,1
"Hot baths, hot hand dryers and other heat will NOT kill coronavirus",1
"No evidence ibuprofen makes Covid-19 worse, say experts",1
"BCG vaccine used in Africa could reduce symptoms, but not ‘cure’ or ‘vaccine’ for Covid-19",1
"Fruit, veg and ‘natural herbs’ can’t cure Covid-19, produce vaccine",1
"No, tea does not cure Covid-19",1
"No, African leaders haven’t endorsed Madagascar’s ‘herbal medicine’ as coronavirus vaccine",1
"No, edible plant known as ewedu, bush okra and jute can’t stop coronavirus spreading in the body",1
"Ginger, turmeric won’t cure coronavirus or other diseases",1
"No, Sultan of Sokoto didn’t say Nigeria’s first Covid-19 case was faked",1
"Three months’ free rent in Kenya during Covid-19 crisis? No, announcement fake",1
"No, you can’t get coronavirus from eating chicken",1
Sudanese minister wearing face mask in meeting with Chinese ambassador? Image photoshopped,1
"No, Kenyan newspaper didn’t report coronavirus patient’s stay at Weston Hotel",1
"Photos not of coronavirus outbreak – and virus not ‘unknown’, fatal in ‘few seconds’",1
"Hong Kong streets empty of protestors after coronavirus? No, photo of Wuhan, China",1
New coronavirus hasn’t killed millions – and photo from art project,1
No evidence Obasanjo said there was no coronavirus in Nigeria,1
"Citizen TV reported Kenya’s ‘second’ coronavirus case, at Multimedia University? No",1
"Kenyans crowding in churches despite coronavirus ban? No, photos years old",1
"No, Putin hasn’t put 800 lions, hyenas on Russian streets to keep people in homes during coronavirus pandemic",1
WHO still recommends self-isolation and social distancing to prevent COVID-19 transmission,1
"No, WHO Did Not Advise Public To Stop Eating Bakery Items!",1
"No, Famous Baby Model Anahita Hashemzadeh Is Not Suffering From COVID19",1
7-Year-Old Image Of Ship Wreck In Italy Falsely Shared As Corona Virus Victims,1
Eid Prayers On Chinese Street In 2019 Shared As Muslim Community Praying For Coronavirus,1
Did Chinese President Visit A Muslim Mosque Recently? Here’s The Truth!,1
Mélange Of Unrelated Videos From China Shared Misleadingly In Context To Recent Corona Virus Outbreak.,1
FALSE: Getting a new tattoo is not a cure for COVID-19,1
Photo of ‘Covid-19’ train tanker manipulated,1
"Kenyans waiting for coronavirus curfew crackdown? No, photo from 2011",1
"Photo of 2013 terrorist attack victim, not Chinese woman killed in Kenya for Covid-19 symptoms ",1
"No, photo not of police brutality during Kenya’s coronavirus curfew",1
"No, photo not of Covid-19 ‘infected’ clothes, blankets – and you won’t get the virus from imported goods",1
Covid-19 spreads more quickly in the dark? Another false claim in overused CNN screenshot,1
"Kenya’s form fours to repeat the year? Screenshot fake, no announcement yet",1
"No, China has not sent Covid-19 vaccines to Nigeria",1
"Seven coronavirus victims shot dead in Rwanda? No, BBC post manipulated",1
"No, member of Chinese medical team in Nigeria hasn’t tested positive for Covid-19",1
"Indian Army dispatching team to be deployed in Sri Lanka to fight COVID-19
",1
News regarding total lockdowns,1
"FAKE: Chinese authorities confirm COVID-19 Patient-Zero had sex with bats
",1
"FAKE: AdaDerana alert claiming the curfew reinforcement time has changed to 6PM
",1
"SCAM: WhatsApp forward ""JOB AT WHO""
",1
"FAKE: China seeks for court’s approval to kill over 20,000 coronavirus patients",1
"Mobile phone cancellations in China don’t prove that 21 million have died of Covid-19
",1
"The USA and China created the novel coronavirus to kill Africans.
",1
"China and Japan are free of the novel Coronavirus.
",1
"China owns the patent for the drug remdesivir
",1
"No, Kenya’s Star newspaper didn’t publish report on face mask hawker diagnosed with Covid-19",1
"Man arrested in Kenya for not wearing mask during coronavirus outbreak? No, photo from 2014 strike",1
"No, UN not ‘unsure of any Covid-19 in Nigeria’ – country has more than 870 cases",1
