headline,real_or_fake
2016 photo of tank in Toronto resurfaces amid COVID-19 outbreak,1
The World Bank did not praise Tanzania’s anti-coronavirus policies,1
The Chinese donation consisted of general medical supplies to help fight COVID-19,1
COVID-19: hoax circulates that viral outbreaks are linked to new telecommunication technologies,1
Posts claim children with COVID-19 must go to hospitals alone,1
These 10 tips for preventing COVID-19 contain false information,1
This video has circulated in reports about Indian activist Trupti Desai's arrest in September 2019,1
Trump did not post this tweet about H1N1 pandemic in 2009,1
Misleading coronavirus information falsely attributed to Johns Hopkins,1
This video has circulated online since 2015 -- years before the COVID-19 pandemic,1
Exclusive: She's been falsely accused of starting the pandemic. Her life has been turned upside down,1
Scientists Haven’t Found Proof The Coronavirus Escaped From A Lab In Wuhan. Trump Supporters Are Spreading The Rumor Anyway.,1
"No, white South Africans not banned from getting Covid-19 government aid",1
"No, palm oil not a ‘simple solution’ to coronavirus",1
Facebook Users Wrongly Tie Dog Vaccine to Novel Coronavirus,1
NOT REAL NEWS: Another week of debunking fake coronavirus headlines and more,1
NOT REAL NEWS: Another week of debunking fake coronavirus headlines and more,1
NOT REAL NEWS: Another week of debunking fake coronavirus headlines and more,1
NOT REAL NEWS: Another week of debunking fake coronavirus headlines and more,1
Photo does not show nurses treating COVID-19 patients in Italy,1
"No, Britain’s Queen Elizabeth did not mention the Philippines in her speech on the novel coronavirus",1
This is an old video showing police officers in Ghana,1
"According to information of UNICEF, Covid19 can be killed in 26 percent temperature قرار معلومات یونیسف، ویروس کرونا در دمای 26 درجه از بین می رود",1
Fact Check: Democrats Do NOT Want Stimulus Payments Taken From Social Security And Military,1
Fact Check: Not Wearing Masks For Tuberculosis In The U.S. Does Not Mean Masks Are Not Needed For COVID-19,1
"Fact Check: Pelosi NOT In Wuhan, China, Six Days After Impeachment",1
Fact Check: Trader Joe's Is NOT Giving Away A Chance To Get $250 Coupon To All,1
"Fact Check: Countering Video, Doctors Say Drug For High-Altitude Sickness is NOT 'Missing Link' In Coronavirus Treatment",1
No Evidence That Flu Shot Increases Risk of COVID-19,1
This video shows monkeys swimming in a pool in India during the COVID-19 lockdown,1
5G deal between UK and Chinese tech company Huawei has not been cancelled,1
"This picture shows the work of a make-up artist, not an infected hand",1
False advice on refusing vaccines circulates during COVID-19 pandemic,1
Online coronavirus scams spread in Nigeria amid lockdowns,1
Photo of Lebanese Reporter Used to Criticize U.S. Media,1
Stimulus Checks Won’t Reduce Future Tax Refunds,1
Conspiracy Theory Misinterprets Goals of Gates Foundation,1
False Claim of Deadly Coronavirus Vaccine Trial in Africa,1
Senegalese children did not die from a coronavirus vaccine (which does not yet exist),1
Claim Nigeria spent 1 billion naira on COVID-19 text messages came from fabricated tweet,1
The corona Virus travelled entire world from Wuhan but it did not reach Beijing and Shanghai... can anybody put light?,1
Corona! Virus? or Bio warfare weapon? ,1
Reports Didn’t Misrepresent One Man’s Death as Two,1
TV News Report Prompts Unfounded Attacks on Michigan Governor,1
South Africa’s education department says the 2020 school year can still be saved,1
"This video has circulated in reports since at least February 2020, weeks before the incident at a coronavirus quarantine facility in India",1
"Désintox. Non, la première volontaire à avoir testé le vaccin contre le coronavirus en Grande-Bretagne n'est pas morte.",1
Baseless Attack on News Media Over Photo of Coffins,1
Union’s Search for Face Masks Gets Twisted Online,1
Social Media Posts Make Baseless Claim on COVID-19 Death Toll,1
Walmart Hasn’t Adopted ‘Staggered Shopping’ Based on Age,1
Fact Check: Kennedy Center Did NOT Give DNC $5M After Getting $25M In Relief From Coronavirus Stimulus,1
A French hospital authority said this video shows French-made medical gowns that were damaged in storage,1
Message suggesting that ‘alkaline foods can kill SARS-CoV-2 virus’ is fake,1
South Africa leader did not ask foreigners to leave the country due to COVID-19,1
This is a photo of a waste management officer that's been circulating since 2018,1
World Health Organization confirmed 'protocol' on COVID-19 lockdown is fake,1
Posts target parents with misleading COVID-19 hospital visit rules,1
False claim: Beijing and Shanghai are untouched by COVID-19,1
Myths about 5G causing the Coronavirus pandemic and the impact,1
Nepalis in England on the receiving end of xenophobia amidst Covid-19 fears ,1
"hese are test kits made in South Korea, not a 'cure' for COVID-19",1
"No evidence that 5G radiation is harmful to human health, experts say",1
This video shows FBI agents seizing masks from alleged price gouger,1
"This video shows landmarks across China, but not Wuhan",1
Health experts say there is no evidence that eating alkaline foods can prevent or cure COVID-19,1
"This video shows a Brazil carnival in 2018, not a party in Italy",1
Stop the spread of fake news ,1
Trump's idea to treat COVID-19 with disinfectant could cause deaths,1
"Facebook to remove fake posts on coronavirus cures
",1
"Coronavirus tests Singapore's laws against misinformation
",1
Pacific governments accused of using coronavirus crisis as cover for media crackdown,1
"FALSE. FAKE NEWS. At this time, new cases are only decreasing in 16 states (18 if you include Puerto Rico and Guam).",1
"Taipei Times:  #Taiwan, US, #Japan hold virtual ‘fake news’ forum addressing how fake news about the #coronavirus is spread online & strengthening the ability of media organizations in the Indo-Pacific region to spot fake news.  #台灣",1
"The nation has had to react to a spate of #paranoia on local social media, wrongly linking Covid-19 and 5g wireless technologies.",1
"Chopped fake photos. Bats are a delicacy in South-East Asian countries and Pacific Islands, not China. And you can't contract virus by consuming cooked meats. ",1
Scientists have not yet confirmed that the time-traveling Coronavirus was responsible for the disappearance of female pilot Amelia Earhart over the Pacific Ocean!,1
"As the Coronavirus crisis grips the entire world and people seek reliable information, misinformation and fake news is being widely shared online.",1
China is pressuring #Taiwan with provocative #airforce maneuvers near the island and spreading fake news to sow discord during the #coronavirus outbreak.,1
all i kno is coronavirus is #fakenews by the #government who wants to #mindcontrol us and the only way to stop it is by sending #footpics to #china,1
Italy is target of fake news campaign by Beijing wt edited videos showing Italians gratitude for China's help in when no such demonstrations took ,1
"China ramping up coronavirus disinformation campaign on Twitter, State Dept. says",1
China was using fake news to to spin their image to be the saviour of the world during the pandemic.  Don't trust their numbers at all.,1
"Taiwan threatening fines of up to 3 million NT (€90,000) for  any coronavirus-related April Fools Day pranks/fake news.",1
Taiwan accuses China of waging cyber war to disrupt coronavirus with fake news,1
Over 70% of Coronavirus Fake News Comes from China,1
"While China was spreading propaganda, Taiwan was responding to COVID-19.",1
"China is busy using fake news attacking the U.S.
Taiwan is collaborating with the U.S. for rapid test kits and vaccine development. ",1
"As part of our efforts to curb #COVID19Microbe disinformation, the govt. of Taiwan has identified 2,029 cases related to the spread of fake news on coronavirus; 606 cases have been placed on file for investigation & 188 (256 people) cases have been prosecuted (as of March 24).",1
Facebook shuts down 60 Chinese accounts for fake coronavirus news in Taiwan trying to spread unease and panic; Chinese netizens have grown more sophisticated in packaging fake news,1
False ‘facts’ on USPS finances resurface on Facebook,1
Face mask ad posted during coronavirus crisis claims stock images show infection-hit family,1
New hoax circulates online that India has outlawed social media posts about COVID-19,1
South Sudan's chief justice and his family tested negative for COVID-19,1
Democrats did vote for legislation to combat the novel coronavirus crisis,1
Philippine authorities warn anti-viral injection has not yet been approved for treating COVID-19,1
Pastor in Nepal accused of spreading misinformation for saying God has power over coronavirus,1
Fake hiring phone numbers shared online in US as unemployment surges,1
This photo shows Australia’s Bondi Beach in 2013,1
Did UP govt issue order restricting samaritans from helping migrants workers?,1
Fake message claims labourers working between 1990 to 2020 will get ₹1.2 lakh benefits,1
False quote attributed to WHO claims no vegetarian has been affected by coronavirus,1
Fake message attributed to ICMR lists 21 dos and don’ts post lockdown,1
"Viral message falsely claims Mumbai and Pune to be under military lockdown, CM debunks rumour",1
Images from Myanmar viral as social distancing in Mizoram vegetable market,1
False quote suggests Japanese Nobel laureate Tasuku Honjo said coronavirus is man-made,1
Old video falsely viral as US students sing Indian national anthem to thank India for HCQ,1
FALSE: FBI arrests Bill Gates for creating coronavirus,1
Misinformation on COVID-19 Death Protocols in New York,1
Hoax Letter Stirs Confusion About Missouri Schools,1
"Lemon Juice Tea Does Not Cure COVID-19 in Israel, or Anywhere Else",1
"No, states like Illinois and California aren’t banning alcohol sales",1
False Claim of Congressional Pay Raises in Stimulus Bill,1
Britain’s first coronavirus vaccine volunteer has not died after trial jab,1
Posts misrepresent eligibility for US COVID-19 stimulus payments,1
Viral videos of Africans attacked in China were filmed years ago,1
Nobel laureate Tasuku Honjo refutes 'false' quote attributed to him about the novel coronavirus,1
Hoax text message circulated online about Australia's coronavirus contact-tracing app,1
Fake: Image of lady on bi-cycle being passed of as Indian migrant is from Nepal ,1
2019 Pic Peddled As Buses Organised By Priyanka Gandhi Vadra For Migrants,1
Fox News Clip About Trump Testing Positive For COVID-19 Is Doctored,1
Video From Pakistan Passed Off As Social Distancing Flouted In Hyderabad,1
"No, This Video Does Not Show Migrants Gathered At Uttar Pradesh Border",1
Video Of A Robbery In Delhi Peddled With False Claims About Migrants,1
Viral Message On Roadmap To Ease COVID-19 Restrictions Not From India,1
Nigeria’s ex-vice president didn't promise to pay citizens to stay home during virus outbreak,1
This graphic with a purported quote from Philippine President Rodrigo Duterte has been doctored,1
Deepika Padukone Spotted Buying Alcohol During The Lockdown? Not Quite,1
Viral Message Warning About Rise In Crimes Post Lockdown Not From Police,1
Is Thrombosis The Leading Cause Of COVID-19 Deaths? A FactCheck,1
"No, Joyalukkas Founder Has Not Died From COVID-19 In Dubai",1
Photo Of Rohingya Muslims Shared As Plight Of Migrants In Lockdown,1
"Viral COVID-19 Advisory Not Published By ICMR, Sir Ganga Ram Hospital",1
"This video was filmed in New York, not China",1
These images show delivery of Chinese medical supplies in Ghana,1
"FALSE: Video of Wuhan, China in ‘2nd wave’ of coronavirus infections",1
This video shows a lodging facility that was converted into a COVID-19 quarantine centre,1
This is an old picture taken before the pandemic,1
"Un centre de ""réduction de la population mondiale"" à la fondation Gates ? Attention, intox !",1
These photos have circulated online since at least 2015 – years before the COVID-19 pandemic,1
This photo shows a nurse in India treating a man who sustained a leg injury,1
This photo has circulated in reports since 2013 about Muslims praying on a Sydney street,1
"WHO warns against self-medicating for COVID-19 with aspirin, lemon juice and honey 'remedy'",1
This may not be the best time to visit a hair salon – but there is no proof they have caused almost half of coronavirus deaths,1
Covid-19 : pas de vaccination ni d’enfants morts en Guinée,1
COVID stands for coronavirus disease 2019,1
No truth to report about robbers posing as coronavirus testers,1
"No, the military doesn’t have COVID-19 quarantine team Humvees in Michigan",1
Putin didn’t threaten jail time for coronavirus lockdown violators,1
Fact Check: Baby Formula NOT Necessarily Being Shipped For Free During Coronavirus Outbreak,1
Guinea has not ordered the arrest of all Chinese nationals,1
"These are test kits made in South Korea, not a 'cure' for COVID-19",1
This rendition of the Indian national anthem was produced in August 2017 to mark India’s 71st Independence Day,1
"No, this photo does not show Canadian Muslims breaking social distancing during Ramadan 2020",1
Trump makes false claims about COVID-19 testing,1
"Residents are advised, but not required, to take COVID-19 precautions",1
This video has circulated since 2016 in reports about a noise complaint at a Mumbai mosque,1
"No, your Census response won’t affect whether you get a federal stimulus check",1
Conspiracy theory falsely connects George Soros to COVID-19,1
"No, Americans aren’t getting $700 weekly checks starting March 17 because of coronavirus",1
Trump Didn’t Tweet Threat to Withhold Relief from Critics,1
"FACT CHECK: DID AN MSNBC REPORTER SAY, ‘I HOPE ENOUGH PEOPLE DIE FROM CORONAVIRUS THAT IT HARMS TRUMP’S RE-ELECTION’?",1
"No, the Clintons aren’t responsible for more deaths than the coronavirus",1
"No, blood donors don’t automatically get a coronavirus test",1
No connection between the US national elections and international pandemics,1
"No, Donald Trump didn’t tweet that Israel has a coronavirus vaccine",1
Romanian conspiracy theory migrates to US amid coronavirus outbreak,1
False claim: Sen. Lindsey Graham said Donald Trump probably knows more about medicine and viruses than any scientist at the NIH and CDC,1
"No, Trump did not create the coronavirus",1
Message Claiming Coronavirus Can Last Up To 8 Hours In Air Is Misleading,1
Coronavirus: Notification On Movement Restrictions Is Not From India,1
PIB Rubbishes Viral WhatsApp Audio Clip Claiming India Will Go Into A Lockdown,1
Morphed India Today Graphic Claims Lockdown Extended To May 4th,1
"Video Of Birds Flocking In Ahmedabad Not Linked To COVID-19 Lockdown
",1
Hoax Message Claims WhatsApp Group Admins Detained For Coronavirus Fake News,1
Marathi Newspaper Lokmat Falls For Fake COVID-19 Bioweapon Story,1
"This bill was for medical services unrelated to COVID-19 treatment, the hospital said",1
Misleading mask graphic claims to show exact chance of COVID-19 spread,1
This video of Boris Johnson has circulated in media reports since August 2018,1
Twitter adds Fei-Fei Li as board member as it grapples with coronavirus misinformation.,1
Ruh roh -- Trump supporters on @Twitter spread #misinformation that China created #coronavirus as a bioweapon.,1
"Twitter allowed China to spread misinformation on coronavirus pandemic, White House Press Secretary Kayleigh McEnany says",1
Fake News Site Invents Story About COVID-19 Patient Zero Having Sex With Bats,1
"No, PM Modi Has Not Announced An Internet Shutdown During Lockdown",1
Did A Netflix Show Predict The COVID-19 Outbreak?,1
False: Viral Message Claiming HDFC Bank MD Aditya Puri's Views On COVID-19,1
Raghuram Rajan Did Not Address IMF Webinar On COVID-19,1
False: Different Types Of Tea Can Act As A Cure For COVID-19,1
False: Harvard Professor Arrested For Manufacturing Novel Coronavirus,1
Viral Message Claiming 11 New Lockdown Rules Not From Mumbai,1
Johns Hopkins Distances Itself From Viral List Of COVID-19 Precautions,1
Michigan governor didn’t have a family event in reopened region,1
Fact Check: Gov. Whitmer NOT Pictured Ignoring Mask And Social-Distancing Rules On Mackinaw Island,1
"No, California Gov. Gavin Newsom hasn’t been vacationing in Montana",1
Post falsely claims people should report Pennsylvania stores that refuse to serve maskless customers,1
Flu shots aren’t causing false positive COVID-19 tests,1
"No, there’s no COVID-19 law that requires rent (or mortgage) refunds",1
No evidence Russian president Putin ordered Madagascar’s Covid-19 ‘cure’,1
Nigeria’s Cov-herbal cough mixture not a cure for Covid-19,1
"No proof siam weed cures coronavirus, as Nigerian prophetess claims",1
"No, drinking black tea at dawn won’t cure coronavirus",1
"No, Tanzania’s president hasn’t banned face masks ",1
‘Shoprite’ giveaway during Covid-19 outbreak a scam,1
"No, South African politicians did not tell public to plant chickens, fish, meat to fight hunger",1
Don’t be conned by fake ad offering jobs at Kenya Red Cross,1
"No, Kenya’s first lady not giving away KSh30,000 Covid-19 grants",1
Footage of bodies at New York funeral home circulates with misleading claim in India,1
This fabricated headline was added to a screenshot of a CNN interview,1
Doctored photo is latest attack on Bill Gates amid COVID-19 vaccine push,1
"No, 250 shop staff in Alberton, South Africa, not Covid-19 positive and ‘told to keep working’",1
"No, Nigerian schools won’t reopen on 8 June",1
"Selling illegal, but no fine for cigarette possession under South Africa’s Covid-19 lockdown",1
"Food parcels in South Africa’s coronavirus lockdown? Ignore fake messages, call 0800 601 011 instead",1
No high court ruling to ‘partially reopen’ Kenya’s churches,1
"Unilever, Sasko, Tastic NOT closing, still making food during South Africa’s coronavirus lockdown",1
No ‘application requirements’ yet for South Africa’s Covid-19 social relief grant – ignore false info,1
Beware imposter accounts! Senator not giving Covid-19 cash to ‘all Kenyans’,1
Beware! World Vision Kenya not offering free water tanks,1
"Free data for Kenyans during coronavirus outbreak? No, it’s a scam",1
"Covid-19 test doesn’t cost N1.2 million (US$3,200) in Nigeria – it’s free",1
"No, China not seeking court’s approval to kill 20,000 coronavirus patients",1
"No, los pedos detectados por cámaras térmicas en este vídeo viral sobre el coronavirus no son reales: han sido añadidos digitalmente",1
Brickfields: Behind YMCA has been cordoned off. 4 Positive Cases of Covid-19 Coronavirus.,1
Nigeria’s health minister studied medicine – not law,1
"No, Kenya’s KTN News didn’t report 14 University of Nairobi students infected with Covid-19",1
"Empty isolation centre in Nigeria’s Kano state means coronavirus is a ‘lie’? No, video misleading",1
False claim: Family of COVID-19 victim broke into morgue to find her still breathing inside body bag,1
"Unmasked Kenyan police arresting man for not wearing mask? Photo from Nigeria, in 2017",1
This video shows a hospital in India,1
Misinformation on US flu shot ingredients resurfaces during pandemic,1
Flu shot will not make you test positive for COVID-19,1
"No, Rwandan president Kagame hasn’t lashed out at World Health Organization",1
"No, Afrikaner-only Orania hasn’t asked South African govt for Covid-19 relief funds",1
"No, Trump didn’t say Nigeria must ‘present’ Covid-19 patients before US sends money",1
"Tanzania’s health minister announced she had Covid-19? No, tweet is fake",1
This graphic about a 'COVID-19 lockdown extension' in the Philippines has been doctored,1
"‘Avoid Kenyans’ because of coronavirus? No, southern African newspaper headline photoshopped",1
No free USA visas for nurses and doctors during coronavirus outbreak,1
"Video of food protest in Nigeria’s Plateau state, not against Covid-19 lockdown in Kano",1
Teens Are Now Claiming They Have Coronavirus for Tik Tok Clout,1
Scientist says a coronavirus vaccine in just 12 months is 'fake news' | 60 Minutes Australia,1
Another claim has been emerging in Australia's Mandarin-speaking LGBTIQ+ community,1
"Not a fake news site... thoughts?: Coronavirus Australia: Queensland researchers find ‘cure’, want drug trial:",1
#Coronavirus Australia: Fake News On Social Media In Sydney https://10daily.com.au/news/australia/a200128ezrjy/claims-coronavirus-hiding-in-energy-drinks-noodles-slammed-by-health-departments-20200128,1
Chinese property buyers flooding back in,1
"Fake picture referring to Peter Oxford's claim that peanut butter, honey and jam are flying off shelves",1
There is a false message going around on social media that Fed Govt is shutting down Australia from tomorrow.,1
"Fake coronavirus warning spreads like wildfire around Australia
",1
"One in eight Australians believe 5G is spreading coronavirus
",1
"Would you pay $550 for a USB drive?
",1
Bill Gates is not on the Australian $10 note,1
"Pamphlet containing COVID-19 misinformation reportedly dropped in Melbourne letterbox
",1
"CoronaCheck: Scrub away, hand sanitiser is unlikely to harm your pets",1
"Anti-vax claims from Senegal
",1
"Flu vaccine controversy hits the NRL
",1
"Are masks dangerous?
",1
"Can you be forced into downloading the COVIDSafe app?
",1
"Has the novel coronavirus been patented?
",1
"Another inaccurate flu vaccine claim
",1
The Royal Melbourne Hospital has taken to Twitter to distance itself from a message circulating online attributed to a “friend who works for the Royal Melbourne Hospital in HR”.,1
"A collective madness seems to have gripped Australia, as evidenced by supermarket shelves left bare in the wake of an onslaught of panic shoppers.",1
Struggling with the thought of being locked inside your house for the foreseeable future? ,1
"Take, for example, a Facebook post claiming that Australians who call their local “communicable disease control branch” would be seen at home by a doctor for free.",1
"""Plandemic"" : le coronavirus est-il un complot ?",1
"Age-old rivalry between NSW and Victoria hasn’t ceased altogether during COVID-19
",1
Japan could pay for part of your post-coronavirus holiday,1
Remdesivir is the latest drug being hailed as a promising treatment for COVID-19,1
Businessman Clive Palmr donated 33 million doses of hydroxychloroquine to Australia's national medical stockpile,1
How to legally decline a vaccine,1
"Australians have been warned to be on the lookout for digital scammers using the coronavirus pandemic to con them into buying goods, sharing personal information and installing malicious software on their computers. ",1
"A video of an altercation in a Melbourne Big W store that went viral is now being used to spread a claim that Chinese nationals have been banned from Australian supermarkets, according to AFP Fact Check.",1
A claim that a Harvard University professor was arrested for manufacturing and selling the coronavirus “bioweapon” to China is false,1
"A photo shared on Facebook and used in reports of the death of one of the UK's youngest coronavirus victims, 13-year-old Ismail Mohamed Abdulwahab, is in fact an image of another 13-year-old, who died by suicide.",1
"White House counsel Kellyanne Conway said ""this is not COVID-19, not COVID-1",1
JK Rowling announced she recovered from coronavirus due to a breathing technique,1
Pete Evans promoted BioCharger NG as treatment option,1
"A suggestion that the masks should be microwaved in order to decontaminate them has been shared widely on social media, but fact checkers are urging caution",1
"A photo shared more than 10,000 times on Facebook apparently shows four Italian healthcare workers collapsed on the floor of an operating theatre",1
One particular Facebook post that questions how China was able to contain the virus keeps cropping up,1
Viral Facebook post describes situation familiar to COVID-19,1
Lemon-bicarb tea concoction cures the virus and is the reason no Israelis have died,1
Distressing claims that children diagnosed with COVID-19 would be transported to hospital and treated without their parents being present has spread to Australia after going viral in the UK and US.,1
A claim posted on Facebook that 500 body bags had been delivered to an ice rink in Adelaide is false,1
Joe Exotic from Tiger King Tests Positive for Coronavirus,1
"South Africa’s ANC ignores Covid-19 social distancing at party? No, photos two years old",1
Scam! KenolKobil not giving away K-Gas cylinders – with ‘delivery fee’ – during Covid-19 outbreak,1
Viral message advertising free ‘lockdown funds’ is scam,1
Saline solution kills China coronavirus? Experts refute online rumour,1
#kazakhstan people burn down homes of Chinese people because of one death due to coronavirus,1
Video shows Chinese officials detaining suspected coronavirus cases,1
Misleading claim circulates that flu vaccines make people more vulnerable to infections,1
US health authorities have not cut reported COVID-19 death toll,1
FALSE: Kenyan artists will not receive Ksh2 billion from the government for COVID-19 relief,1
Scammers use WhatsApp chain message about COVID-19 and fake profiles to harvest personal data in South Africa,1
Disinfo targeting South African Defence Force surges amid COVID-19 lockdown,1
"PM makes unfounded claims about PCR test rate, virtues of Nepali diet",1
Coronavirus conspiracies amplified on social media by fringe South African political party,1
‘Plandemic’ video peddles falsehoods about COVID-19,1
False: Queensland issued travel warning for Wuhan and Chinese-populated areas in Australia.,1
False: Food and locations are contaminated in Australia.,1
